[
  {
    "unit_id": "AO-LUA",
    "parent_unit_id": "",
    "country_code_iso2": "AO",
    "admin_level": 1,
    "official_name": "Luanda",
    "normalized_name": "luanda",
    "unit_type": "province",
    "has_communes": "true",
    "districts_or_localities": "",
    "status": "verified_official_portal",
    "source_url": "https://governo.gov.ao/provincia/luanda",
    "source_date_checked": "2026-06-26",
    "notes": "Capital provincial: Ingombota; portal oficial indica 16 municípios."
  },
  {
    "unit_id": "AO-LUA-LUA",
    "parent_unit_id": "AO-LUA",
    "country_code_iso2": "AO",
    "admin_level": 2,
    "official_name": "Luanda",
    "normalized_name": "luanda",
    "unit_type": "municipality",
    "has_communes": "false",
    "districts_or_localities": "Sambizanga, Rangel, Maianga, Ingombota, Samba, Neves Bendinha, Ngola Kiluanje",
    "status": "verified_official_portal",
    "source_url": "https://governo.gov.ao/provincia/luanda",
    "source_date_checked": "2026-06-26",
    "notes": "Portal oficial lista sem comunas. Distritos/localidades devem ser tratados como camada separada."
  },
  {
    "unit_id": "AO-LUA-CAC",
    "parent_unit_id": "AO-LUA",
    "country_code_iso2": "AO",
    "admin_level": 2,
    "official_name": "Cacuaco",
    "normalized_name": "cacuaco",
    "unit_type": "municipality",
    "has_communes": "true",
    "districts_or_localities": "Kikolo, Cacuaco, Mulenvos de Baixo, Sequele",
    "status": "verified_official_portal",
    "source_url": "https://governo.gov.ao/provincia/luanda",
    "source_date_checked": "2026-06-26",
    "notes": "Portal oficial lista comunas."
  },
  {
    "unit_id": "AO-LUA-CAZ",
    "parent_unit_id": "AO-LUA",
    "country_code_iso2": "AO",
    "admin_level": 2,
    "official_name": "Cazenga",
    "normalized_name": "cazenga",
    "unit_type": "municipality",
    "has_communes": "true",
    "districts_or_localities": "Cazenga, Hoji ya Henda, 11 de Novembro, Kima Kieza, Tala Hadi, Kalawenda",
    "status": "verified_official_portal",
    "source_url": "https://governo.gov.ao/provincia/luanda",
    "source_date_checked": "2026-06-26",
    "notes": "Portal oficial lista comunas."
  },
  {
    "unit_id": "AO-LUA-VIA",
    "parent_unit_id": "AO-LUA",
    "country_code_iso2": "AO",
    "admin_level": 2,
    "official_name": "Viana",
    "normalized_name": "viana",
    "unit_type": "municipality",
    "has_communes": "true",
    "districts_or_localities": "Viana, Estalagem, Kikuxi, Baía, Zango, Vila Flôr",
    "status": "verified_official_portal",
    "source_url": "https://governo.gov.ao/provincia/luanda",
    "source_date_checked": "2026-06-26",
    "notes": "Portal oficial lista comunas."
  },
  {
    "unit_id": "AO-LUA-BEL",
    "parent_unit_id": "AO-LUA",
    "country_code_iso2": "AO",
    "admin_level": 2,
    "official_name": "Belas",
    "normalized_name": "belas",
    "unit_type": "municipality",
    "has_communes": "true",
    "districts_or_localities": "Quenguela, Morro dos Veados, Ramiros, Vila Verde, Cabolombo, Kilamba",
    "status": "verified_official_portal",
    "source_url": "https://governo.gov.ao/provincia/luanda",
    "source_date_checked": "2026-06-26",
    "notes": "Portal oficial lista comunas."
  },
  {
    "unit_id": "AO-LUA-TAL",
    "parent_unit_id": "AO-LUA",
    "country_code_iso2": "AO",
    "admin_level": 2,
    "official_name": "Talatona",
    "normalized_name": "talatona",
    "unit_type": "municipality",
    "has_communes": "true",
    "districts_or_localities": "Benfica, Futungo de Belas, Lar do Patriota, Talatona, Camama, Cidade Universitária",
    "status": "verified_official_portal",
    "source_url": "https://governo.gov.ao/provincia/luanda",
    "source_date_checked": "2026-06-26",
    "notes": "Portal oficial lista comunas."
  },
  {
    "unit_id": "AO-LUA-MUS",
    "parent_unit_id": "AO-LUA",
    "country_code_iso2": "AO",
    "admin_level": 2,
    "official_name": "Mussulo",
    "normalized_name": "mussulo",
    "unit_type": "municipality",
    "has_communes": "false",
    "districts_or_localities": "Sem distritos",
    "status": "verified_official_portal",
    "source_url": "https://governo.gov.ao/provincia/luanda",
    "source_date_checked": "2026-06-26",
    "notes": "Portal oficial lista sem comunas. Distritos/localidades devem ser tratados como camada separada."
  },
  {
    "unit_id": "AO-LUA-SAMZ",
    "parent_unit_id": "AO-LUA",
    "country_code_iso2": "AO",
    "admin_level": 2,
    "official_name": "Sambizanga",
    "normalized_name": "sambizanga",
    "unit_type": "municipality",
    "has_communes": "false",
    "districts_or_localities": "Sem distritos",
    "status": "verified_official_portal",
    "source_url": "https://governo.gov.ao/provincia/luanda",
    "source_date_checked": "2026-06-26",
    "notes": "Portal oficial lista sem comunas. Distritos/localidades devem ser tratados como camada separada."
  },
  {
    "unit_id": "AO-LUA-RAN",
    "parent_unit_id": "AO-LUA",
    "country_code_iso2": "AO",
    "admin_level": 2,
    "official_name": "Rangel",
    "normalized_name": "rangel",
    "unit_type": "municipality",
    "has_communes": "false",
    "districts_or_localities": "Sem distritos",
    "status": "verified_official_portal",
    "source_url": "https://governo.gov.ao/provincia/luanda",
    "source_date_checked": "2026-06-26",
    "notes": "Portal oficial lista sem comunas. Distritos/localidades devem ser tratados como camada separada."
  },
  {
    "unit_id": "AO-LUA-MAI",
    "parent_unit_id": "AO-LUA",
    "country_code_iso2": "AO",
    "admin_level": 2,
    "official_name": "Maianga",
    "normalized_name": "maianga",
    "unit_type": "municipality",
    "has_communes": "false",
    "districts_or_localities": "Sem distritos",
    "status": "verified_official_portal",
    "source_url": "https://governo.gov.ao/provincia/luanda",
    "source_date_checked": "2026-06-26",
    "notes": "Portal oficial lista sem comunas. Distritos/localidades devem ser tratados como camada separada."
  },
  {
    "unit_id": "AO-LUA-SAMB",
    "parent_unit_id": "AO-LUA",
    "country_code_iso2": "AO",
    "admin_level": 2,
    "official_name": "Samba",
    "normalized_name": "samba",
    "unit_type": "municipality",
    "has_communes": "false",
    "districts_or_localities": "Sem distritos",
    "status": "verified_official_portal",
    "source_url": "https://governo.gov.ao/provincia/luanda",
    "source_date_checked": "2026-06-26",
    "notes": "Portal oficial lista sem comunas. Distritos/localidades devem ser tratados como camada separada."
  },
  {
    "unit_id": "AO-LUA-CAM",
    "parent_unit_id": "AO-LUA",
    "country_code_iso2": "AO",
    "admin_level": 2,
    "official_name": "Camama",
    "normalized_name": "camama",
    "unit_type": "municipality",
    "has_communes": "false",
    "districts_or_localities": "Sem distritos",
    "status": "verified_official_portal",
    "source_url": "https://governo.gov.ao/provincia/luanda",
    "source_date_checked": "2026-06-26",
    "notes": "Portal oficial lista sem comunas. Distritos/localidades devem ser tratados como camada separada."
  },
  {
    "unit_id": "AO-LUA-MUL",
    "parent_unit_id": "AO-LUA",
    "country_code_iso2": "AO",
    "admin_level": 2,
    "official_name": "Mulenvos",
    "normalized_name": "mulenvos",
    "unit_type": "municipality",
    "has_communes": "false",
    "districts_or_localities": "Sem distritos",
    "status": "verified_official_portal",
    "source_url": "https://governo.gov.ao/provincia/luanda",
    "source_date_checked": "2026-06-26",
    "notes": "Portal oficial lista sem comunas. Distritos/localidades devem ser tratados como camada separada."
  },
  {
    "unit_id": "AO-LUA-KIL",
    "parent_unit_id": "AO-LUA",
    "country_code_iso2": "AO",
    "admin_level": 2,
    "official_name": "Kilamba",
    "normalized_name": "kilamba",
    "unit_type": "municipality",
    "has_communes": "true",
    "districts_or_localities": "Sem distritos",
    "status": "verified_official_portal",
    "source_url": "https://governo.gov.ao/provincia/luanda",
    "source_date_checked": "2026-06-26",
    "notes": "Portal oficial lista comunas."
  },
  {
    "unit_id": "AO-LUA-HOH",
    "parent_unit_id": "AO-LUA",
    "country_code_iso2": "AO",
    "admin_level": 2,
    "official_name": "Hoji Ya Henda",
    "normalized_name": "hoji ya henda",
    "unit_type": "municipality",
    "has_communes": "false",
    "districts_or_localities": "Sem distritos",
    "status": "verified_official_portal",
    "source_url": "https://governo.gov.ao/provincia/luanda",
    "source_date_checked": "2026-06-26",
    "notes": "Portal oficial lista sem comunas. Distritos/localidades devem ser tratados como camada separada."
  },
  {
    "unit_id": "AO-LUA-ING",
    "parent_unit_id": "AO-LUA",
    "country_code_iso2": "AO",
    "admin_level": 2,
    "official_name": "Ingombota",
    "normalized_name": "ingombota",
    "unit_type": "municipality",
    "has_communes": "false",
    "districts_or_localities": "Sem distritos",
    "status": "verified_official_portal",
    "source_url": "https://governo.gov.ao/provincia/luanda",
    "source_date_checked": "2026-06-26",
    "notes": "Portal oficial lista sem comunas. Distritos/localidades devem ser tratados como camada separada."
  },
  {
    "unit_id": "AO-LUA-CAC-001",
    "parent_unit_id": "AO-LUA-CAC",
    "country_code_iso2": "AO",
    "admin_level": 3,
    "official_name": "Cacuaco",
    "normalized_name": "cacuaco",
    "unit_type": "commune",
    "has_communes": "false",
    "districts_or_localities": "",
    "status": "verified_official_portal",
    "source_url": "https://governo.gov.ao/provincia/luanda",
    "source_date_checked": "2026-06-26",
    "notes": "Comuna do município de Cacuaco conforme portal oficial."
  },
  {
    "unit_id": "AO-LUA-CAC-002",
    "parent_unit_id": "AO-LUA-CAC",
    "country_code_iso2": "AO",
    "admin_level": 3,
    "official_name": "Kikolo",
    "normalized_name": "kikolo",